{
  "$schema": "../../system/schemas/metaObjectStorableSettings.schema.json",
  "Uid": "a3f1b8e2-7c4d-4a5b-9e6f-1d2c3b4a5e6f",
  "MetaObjectKindUid": "5449a8ad-9359-41b2-8ff2-3f415eb4da76",
  "Title": "Статус договора",
  "Name": "contract_status",
  "Memo": "Возможные статусы договора в процессе согласования и исполнения",
  "EditMethod": 0,
  "OrderByExpression": "",
  "DisplayExpression": "",
  "ListFormUid": null,
  "ItemFormUid": null,
  "ShowMainImage": false,
  "IsActive": true,
  "Header": {
    "Uid": "b4e2c9f3-8d5e-4b6c-af7a-2e3d4c5b6f7a",
    "Title": "header",
    "Name": "header",
    "Memo": "",
    "AutoClearMethod": 0,
    "Columns": [
      {
        "Uid": "c5f3dae4-9e6f-4c7d-bb8b-3f4e5d6c7a8b",
        "Kind": 0,
        "StandardColumnUid": "3cceebad-7d5a-4943-a102-6267e22227a8",
        "Title": "Имя",
        "Name": "name",
        "Formula": "",
        "ItemsSource": "",
        "AutoClearMethod": 0,
        "IsStandard": true,
        "DataSettings": {
          "DataTypeUid": "0234c067-7868-46b2-ba8e-e22fae5255cb",
          "StringLength": 20,
          "NumberDigits": 2,
          "PrimaryKey": true,
          "Required": false,
          "Unique": false,
          "DefaultValue": null
        },
        "RenderSettings": {
          "ControlKindUid": "",
          "ShowInItem": true,
          "ShowInList": true,
          "ListColumnWidth": ""
        },
        "Dependencies": []
      },
      {
        "Uid": "d6e4ebf5-af70-4d8e-9c9c-4f5d6e7a8b9c",
        "Kind": 0,
        "StandardColumnUid": "1e0063d0-288d-494a-8761-1185300d571d",
        "Title": "Удалено",
        "Name": "is_deleted",
        "Formula": "",
        "ItemsSource": "",
        "AutoClearMethod": 0,
        "IsStandard": true,
        "DataSettings": {
          "DataTypeUid": "4bff64cf-eb01-4933-9f3d-b902336751f4",
          "StringLength": 100,
          "NumberDigits": 2,
          "PrimaryKey": false,
          "Required": false,
          "Unique": false,
          "DefaultValue": null
        },
        "RenderSettings": {
          "ControlKindUid": "",
          "ShowInItem": true,
          "ShowInList": false,
          "ListColumnWidth": ""
        },
        "Dependencies": []
      },
      {
        "Uid": "e7f5fc06-bf81-4e9f-9dad-5f6e7a8b9c0d",
        "Kind": 0,
        "StandardColumnUid": "e647fb57-470e-4547-9a94-2be0f3d0985e",
        "Title": "Код",
        "Name": "code",
        "Formula": "",
        "ItemsSource": "",
        "AutoClearMethod": 0,
        "IsStandard": true,
        "DataSettings": {
          "DataTypeUid": "0234c067-7868-46b2-ba8e-e22fae5255cb",
          "StringLength": 3,
          "NumberDigits": 2,
          "PrimaryKey": false,
          "Required": true,
          "Unique": true,
          "DefaultValue": null
        },
        "RenderSettings": {
          "ControlKindUid": "",
          "ShowInItem": true,
          "ShowInList": true,
          "ListColumnWidth": ""
        },
        "Dependencies": []
      },
      {
        "Uid": "f8e6cd17-c092-4faf-aebe-6e7a8b9c0d1e",
        "Kind": 0,
        "StandardColumnUid": "91a26ae4-5723-4109-8322-7e4e59129239",
        "Title": "Заголовок",
        "Name": "title",
        "Formula": "",
        "ItemsSource": "",
        "AutoClearMethod": 0,
        "IsStandard": true,
        "DataSettings": {
          "DataTypeUid": "0234c067-7868-46b2-ba8e-e22fae5255cb",
          "StringLength": 100,
          "NumberDigits": 2,
          "PrimaryKey": false,
          "Required": true,
          "Unique": false,
          "DefaultValue": null
        },
        "RenderSettings": {
          "ControlKindUid": "",
          "ShowInItem": true,
          "ShowInList": true,
          "ListColumnWidth": ""
        },
        "Dependencies": []
      }
    ],
    "Indexes": [
      {
        "Uid": "a9f7de28-d1a3-4ab0-aacf-7a8b9c0d1e2f",
        "Columns": [
          {
            "ColumnUid": "d6e4ebf5-af70-4d8e-9c9c-4f5d6e7a8b9c",
            "Direction": 0
          }
        ]
      },
      {
        "Uid": "bae8ef39-e2b4-4bc1-bbe0-8b9c0d1e2f3a",
        "Columns": [
          {
            "ColumnUid": "e7f5fc06-bf81-4e9f-9dad-5f6e7a8b9c0d",
            "Direction": 0
          }
        ]
      }
    ]
  },
  "DetailTables": [],
  "Commands": [],
  "RecordsSources": [],
  "RecordsSettings": []
}